{
  "$schema": "https://json-schema.org/draft/2020-12/schema",
  "$id": "https://sakura.local/harness/tasks/schema-v1.json",
  "title": "Sakura Agent Development Harness task contract v1",
  "type": "object",
  "additionalProperties": false,
  "required": [
    "schema_version",
    "id",
    "title",
    "status_source",
    "documents",
    "dependencies",
    "base_ref",
    "allowed_paths",
    "forbidden_paths",
    "protected_paths",
    "dependency_policy",
    "required_profiles",
    "acceptance",
    "rollback"
  ],
  "properties": {
    "schema_version": {"const": 1},
    "id": {"type": "string", "pattern": "^WP-[A-Z0-9]+(?:-[A-Z0-9]+)+$"},
    "title": {"type": "string", "minLength": 1},
    "status_source": {"const": "docs/plans/runtime-v2/work-packages.md"},
    "documents": {
      "type": "object",
      "additionalProperties": false,
      "required": ["specs", "adrs", "plans"],
      "properties": {
        "specs": {"$ref": "#/$defs/nonEmptyUniqueStrings"},
        "adrs": {"$ref": "#/$defs/nonEmptyUniqueStrings"},
        "plans": {"$ref": "#/$defs/nonEmptyUniqueStrings"}
      }
    },
    "dependencies": {"type": "array", "items": {"type": "string"}, "uniqueItems": true},
    "base_ref": {"type": "string", "minLength": 1},
    "allowed_paths": {"$ref": "#/$defs/nonEmptyUniqueStrings"},
    "forbidden_paths": {"$ref": "#/$defs/nonEmptyUniqueStrings"},
    "protected_paths": {"$ref": "#/$defs/nonEmptyUniqueStrings"},
    "dependency_policy": {
      "type": "object",
      "additionalProperties": false,
      "required": ["mode", "allowed_files"],
      "properties": {
        "mode": {"enum": ["forbidden", "allowlisted"]},
        "allowed_files": {"type": "array", "items": {"type": "string", "minLength": 1}, "uniqueItems": true}
      },
      "allOf": [
        {
          "if": {"properties": {"mode": {"const": "forbidden"}}},
          "then": {"properties": {"allowed_files": {"maxItems": 0}}}
        }
      ]
    },
    "required_profiles": {"$ref": "#/$defs/nonEmptyUniqueStrings"},
    "acceptance": {
      "type": "object",
      "additionalProperties": false,
      "required": ["automated", "manual"],
      "properties": {
        "automated": {"$ref": "#/$defs/nonEmptyUniqueStrings"},
        "manual": {"type": "array", "items": {"type": "string", "minLength": 1}, "uniqueItems": true}
      }
    },
    "rollback": {"$ref": "#/$defs/nonEmptyUniqueStrings"}
  },
  "$defs": {
    "nonEmptyUniqueStrings": {
      "type": "array",
      "minItems": 1,
      "items": {"type": "string", "minLength": 1},
      "uniqueItems": true
    }
  }
}
