{
  "schema_version": 1,
  "id": "WP-4-01",
  "title": "Runtime v2 Memory 能力等价",
  "status_source": "docs/plans/runtime-v2/work-packages.md",
  "documents": {
    "specs": [
      "docs/specs/runtime-v2/README.md",
      "docs/specs/runtime-v2/WP-4-01-memory-capability.md",
      "docs/specs/runtime-v2/product-capability-parity.md",
      "docs/specs/runtime-v2/settings-incremental-migration.md"
    ],
    "adrs": [
      "docs/adr/0001-runtime-v2-process-supervision.md",
      "docs/adr/0002-runtime-v2-ipc.md",
      "docs/adr/0003-runtime-v2-data-compatibility.md",
      "docs/adr/0004-runtime-v2-cross-platform-foundation.md",
      "docs/adr/0005-runtime-v2-headless-assistant-adapter.md",
      "docs/adr/0006-same-app-settings-host.md",
      "docs/adr/0007-incremental-settings-feature-migration.md",
      "docs/adr/0008-agent-development-harness.md"
    ],
    "plans": [
      "docs/plans/runtime-v2/delivery-governance.md",
      "docs/plans/runtime-v2/work-packages.md"
    ]
  },
  "dependencies": ["WP-3V-01"],
  "base_ref": "5fc9e56ccc091b8e099935fe5035d76b14be5e03",
  "allowed_paths": [
    ".github/workflows/runtime-v2-platform-foundation.yml",
    "CHANGELOG.md",
    "app/agent/memory.py",
    "app/agent/memory_curator.py",
    "app/agent/memory_recall.py",
    "app/agent/runtime.py",
    "app/config/core_config_reader.py",
    "app/config/provider_model_settings.py",
    "app/config/settings_service.py",
    "app/core_host/assistant_adapter.py",
    "app/core_host/memory_boundary.py",
    "app/core_host/real_chat.py",
    "app/core_host/router.py",
    "app/core_host/server.py",
    "app/storage/atomic.py",
    "app/storage/chat_history.py",
    "app/storage/paths.py",
    "desktop/frontend/settings/capability-shell.js",
    "desktop/frontend/settings/appearance-runtime.js",
    "desktop/frontend/settings/index.html",
    "desktop/frontend/settings/memory-runtime.js",
    "desktop/frontend/settings/settings.js",
    "desktop/frontend/settings/styles.css",
    "desktop/frontend/tests/**",
    "desktop/src-tauri/src/core_host_gateway.rs",
    "desktop/src-tauri/src/core_host_runtime.rs",
    "desktop/src-tauri/src/main.rs",
    "desktop/src-tauri/src/memory_gateway.rs",
    "desktop/src-tauri/src/product_shell.rs",
    "desktop/tests/**",
    "docs/adr/0001-runtime-v2-process-supervision.md",
    "docs/adr/0002-runtime-v2-ipc.md",
    "docs/adr/0003-runtime-v2-data-compatibility.md",
    "docs/adr/0004-runtime-v2-cross-platform-foundation.md",
    "docs/adr/0005-runtime-v2-headless-assistant-adapter.md",
    "docs/adr/0006-same-app-settings-host.md",
    "docs/adr/0007-incremental-settings-feature-migration.md",
    "docs/adr/0008-agent-development-harness.md",
    "docs/devdocs/TECHNICAL_README.md",
    "docs/plans/runtime-v2/delivery-governance.md",
    "docs/plans/runtime-v2/work-packages.md",
    "docs/records/audits/**",
    "docs/specs/runtime-v2/README.md",
    "docs/specs/runtime-v2/WP-4-01-memory-capability.md",
    "docs/specs/runtime-v2/product-capability-parity.md",
    "docs/specs/runtime-v2/settings-incremental-migration.md",
    "docs/userdocs/SETUP.md",
    "harness/README.md",
    "harness/activations/WP-4-01/**",
    "harness/suites.json",
    "harness/tasks/WP-4-01.json",
    "tests/fixtures/runtime_v2/wp_4_01/**",
    "tests/integration/test_wp_4_01_memory_capability.py",
    "tests/unit/test_agent_runtime.py",
    "tests/unit/test_core_host_config_reader.py",
    "tests/unit/test_core_host_memory.py",
    "tests/unit/test_core_host_protocol.py",
    "tests/unit/test_memory_curator.py",
    "tests/unit/test_memory_store_resources.py",
    "tests/unit/test_provider_model_settings.py",
    "tests/unit/test_settings_service.py"
  ],
  "forbidden_paths": [
    "app/agent/memory_curation_worker.py",
    "app/agent/mcp/**",
    "app/agent/tools.py",
    "app/core/app_context.py",
    "app/core/bootstrap.py",
    "app/plugins/**",
    "app/ui/**",
    "app/voice/**",
    "desktop/src-tauri/Cargo.lock",
    "desktop/src-tauri/Cargo.toml",
    "desktop/src-tauri/tauri.conf.json",
    "legacy_qt_main.py",
    "main.py",
    "plugins/**",
    "runtime/**",
    "tools/mcp/**"
  ],
  "protected_paths": ["data/**", "characters/**", "third_party/**"],
  "dependency_policy": {"mode": "forbidden", "allowed_files": []},
  "required_profiles": [
    "docs",
    "smoke",
    "core-host",
    "runtime-v2-shell",
    "python-full"
  ],
  "acceptance": {
    "automated": [
      "the negotiated Qt-free Core Memory owner injects bounded role-scoped recall into real chat while every Memory initialization, embedding, Qdrant, SQLite and curation failure degrades to an empty recall without blocking or replaying chat",
      "search, create, update, idempotent delete and completed-turn curation preserve layer, scope and cursor semantics under concurrent access, cancellation, storage failures and generation replacement",
      "Memory settings and management feature DTOs, validation, atomic save, model-slot restart plan, fixed embedding import and explicit download complete through the authorized settings window without path or secret disclosure",
      "future or corrupt data, lock conflict, read-only storage, interrupted atomic replacement, invalid archive, download failure and stale generation handles preserve the previous readable data and stable UI state",
      "normal exit, settings close, task cancel, forced Core termination and Shell exit reclaim every Memory thread, waiter, Qdrant and SQLite resource, lock, pipe and temporary root within the bounded shutdown policy",
      "isolated headless reference-to-Runtime-v2-to-reference data compatibility, sanitized manifests, locked required profiles and same-candidate Windows x64, macOS arm64 and Linux x64 workflow pass without legacy memory.json, protected-data, dependency or out-of-scope changes"
    ],
    "manual": [
      "maintainer directly starts the current Runtime v2 executable in the isolated acceptance root and completes Memory search, Chinese and Japanese IME create/edit/delete, draft preservation, recall-influenced chat and one completed curation cycle",
      "maintainer validates embedding import failure recovery, settings save and reopen, Core termination and fresh-generation recovery, normal exit, immediate shared-lock reacquisition and zero related process or Memory resource residue",
      "maintainer reviews the same candidate SHA three-platform data and resource evidence, sanitized manifest and logs, Memory-only rollback, unchanged legacy memory.json and the boundary excluding Legacy Qt UI, generic Operation and Memory tools"
    ]
  },
  "rollback": [
    "mark memory.manage, memory.curation, memory.embedding_model and model.memory_curation_slot unavailable before accepting new Memory or model tasks",
    "cancel the current generation's curation and model tasks, exit Core and verify all Memory resources and shared locks are released",
    "revert only the WP-4-01 Memory Gateway, Core owner, settings wiring, tests and evidence, restoring DisabledMemory chat degradation without reverting accepted predecessors",
    "preserve every user Qdrant, SQLite, JSON, embedding cache, configuration and completed history file; never delete, restore, rebuild, migrate or repair Memory data during rollback"
  ]
}
