{
  "schema_version": 1,
  "id": "WP-2-01",
  "title": "最小并发 Router 事件顺序稳定化",
  "status_source": "docs/plans/runtime-v2/work-packages.md",
  "documents": {
    "specs": [
      "docs/specs/runtime-v2/WP-2-01-minimal-concurrent-router.md",
      "docs/specs/runtime-v2/WP-2-02-minimal-chat-boundary.md"
    ],
    "adrs": ["docs/adr/0002-runtime-v2-ipc.md"],
    "plans": ["docs/plans/runtime-v2/work-packages.md"]
  },
  "dependencies": ["WP-1D-01"],
  "base_ref": "d47cd414ce37249ca94cd93812deb6cacfeacc8f",
  "allowed_paths": [
    "desktop/src-tauri/src/core_host_router.rs",
    "docs/plans/runtime-v2/work-packages.md",
    "docs/records/audits/README.md",
    "docs/records/audits/WP-3V-01-ROUTER-ORDERING-DEFECT.md",
    "harness/activations/WP-2-01/0001.json",
    "harness/tasks/WP-2-01.json"
  ],
  "forbidden_paths": [
    ".github/**",
    "app/**",
    "desktop/frontend/**",
    "desktop/src-tauri/Cargo.lock",
    "desktop/src-tauri/Cargo.toml",
    "desktop/src-tauri/src/chat_bridge.rs",
    "desktop/src-tauri/src/core_host_gateway.rs",
    "desktop/src-tauri/src/core_host_runtime.rs",
    "desktop/src-tauri/src/main.rs",
    "desktop/src-tauri/src/shell_lifecycle.rs",
    "desktop/src-tauri/tauri.conf.json",
    "legacy_qt_main.py",
    "main.py",
    "plugins/**",
    "runtime/**",
    "tests/**",
    "tools/mcp/**"
  ],
  "protected_paths": ["data/**", "characters/**", "third_party/**"],
  "dependency_policy": {"mode": "forbidden", "allowed_files": []},
  "required_profiles": ["docs", "smoke", "core-host", "runtime-v2-shell"],
  "acceptance": {
    "automated": [
      "a fast chat.started and chat.completed pair is delivered in wire order even when both are queued before the consumer polls",
      "terminal events retain bounded reserved capacity and cannot be silently dropped or overtaken by non-terminal events",
      "response and event interleaving, queue saturation, generation invalidation and complete Router cleanup regressions pass",
      "the WP-3V-01 real Windows Assistant architecture acceptance advances past the first completed reply without weakening its Provider or event timing"
    ],
    "manual": [
      "maintainer reviews the minimal ordering fix, bounded-capacity behavior and WP-3V-01 failure/recovery evidence before re-accepting WP-2-01"
    ]
  },
  "rollback": [
    "stop Runtime v2 and verify the complete Shell and Core process tree is gone",
    "revert only the Router ordering fix and its inline regression test without changing protocol, Gateway, UI or user data",
    "return WP-2-01 to stabilizing and keep WP-3V-01 planned if the original reordering defect returns"
  ]
}
