{
  "schema_version": 1,
  "id": "WP-H-01",
  "title": "Agent Development Harness Foundation",
  "status_source": "docs/plans/runtime-v2/work-packages.md",
  "documents": {
    "specs": ["docs/specs/runtime-v2/WP-H-01-agent-development-harness.md"],
    "adrs": ["docs/adr/0008-agent-development-harness.md"],
    "plans": ["docs/plans/agent-development-harness-v1.md"]
  },
  "dependencies": ["WP-3S-01"],
  "base_ref": "642c1b005550e41e3b16838e086c8c5ff2d13e44",
  "allowed_paths": [
    ".github/workflows/test.yml",
    ".github/workflows/runtime-v2-platform-foundation.yml",
    "AGENTS.md",
    "docs/adr/0008-agent-development-harness.md",
    "docs/devdocs/AGENT_DEVELOPMENT_HARNESS.md",
    "docs/plans/agent-development-harness-v1.md",
    "docs/plans/runtime-v2/**",
    "docs/records/audits/**",
    "docs/specs/runtime-v2/WP-H-01-agent-development-harness.md",
    "harness/**",
    "tests/unit/test_harness_*.py"
  ],
  "forbidden_paths": [
    "app/**",
    "desktop/**",
    "plugins/**",
    "runtime/**",
    "tools/mcp/**"
  ],
  "protected_paths": ["data/**", "characters/**", "third_party/**"],
  "dependency_policy": {"mode": "forbidden", "allowed_files": []},
  "required_profiles": ["docs", "smoke", "unit"],
  "acceptance": {
    "automated": [
      "existing runner compatibility tests pass",
      "task contract, Work Package, Git scope and report tests pass",
      "docs and smoke profiles pass",
      "CI runs Harness self-tests on refactor/tauri-runtime-v2"
    ],
    "manual": [
      "maintainer reviews the frozen contract and bootstrap exception closure"
    ]
  },
  "rollback": [
    "revert CI task verification entry points",
    "revert task commands and checks while preserving list/run profiles",
    "revert task contracts and governance documentation"
  ]
}
