{
  "schema_version": 1,
  "id": "WP-3-04",
  "title": "真实聊天接入已冻结桌宠 UI",
  "status_source": "docs/plans/runtime-v2/work-packages.md",
  "documents": {
    "specs": [
      "docs/specs/runtime-v2/WP-3-04-real-chat-frozen-pet-ui.md",
      "docs/specs/runtime-v2/settings-incremental-migration.md"
    ],
    "adrs": [
      "docs/adr/0002-runtime-v2-ipc.md",
      "docs/adr/0003-runtime-v2-data-compatibility.md",
      "docs/adr/0006-same-app-settings-host.md",
      "docs/adr/0007-incremental-settings-feature-migration.md"
    ],
    "plans": ["docs/plans/runtime-v2/work-packages.md"]
  },
  "dependencies": ["WP-H-01"],
  "base_ref": "4d3e34fc10ad770847694c9203f8e562c182d9f2",
  "allowed_paths": [
    ".gitignore",
    ".github/workflows/runtime-v2-platform-foundation.yml",
    "CHANGELOG.md",
    "app/core_host/real_chat.py",
    "desktop/frontend/app.js",
    "desktop/frontend/index.html",
    "desktop/frontend/styles.css",
    "desktop/frontend/chat/**",
    "desktop/frontend/pet/**",
    "desktop/frontend/settings/**",
    "desktop/frontend/tests/**",
    "desktop/src-tauri/src/character_appearance.rs",
    "desktop/src-tauri/src/chat_bridge.rs",
    "desktop/src-tauri/src/chat_settings.rs",
    "desktop/src-tauri/src/core_host_gateway.rs",
    "desktop/src-tauri/src/main.rs",
    "desktop/src-tauri/src/product_shell.rs",
    "desktop/src-tauri/src/shell_lifecycle.rs",
    "desktop/src-tauri/src/ui_config.rs",
    "desktop/tests/**",
    "docs/plans/runtime-v2/work-packages.md",
    "docs/records/audits/**",
    "docs/specs/runtime-v2/README.md",
    "docs/specs/runtime-v2/WP-3-04-real-chat-frozen-pet-ui.md",
    "docs/specs/runtime-v2/product-capability-parity.md",
    "docs/specs/runtime-v2/settings-incremental-migration.md",
    "docs/userdocs/SETUP.md",
    "harness/activations/WP-3-04/0001.json",
    "harness/activations/WP-3-04/0002.json",
    "harness/activations/WP-3-04/0003.json",
    "harness/activations/WP-3-04/0004.json",
    "harness/activations/WP-3-04/0005.json",
    "harness/tasks/WP-3-04.json",
    "tests/integration/test_core_host_real_chat_integration.py",
    "tests/fixtures/runtime_v2/wp_3_04/**",
    "tools/settings-tauri/**"
  ],
  "forbidden_paths": [
    "desktop/src-tauri/Cargo.lock",
    "desktop/src-tauri/Cargo.toml",
    "desktop/src-tauri/tauri.conf.json",
    "legacy_qt_main.py",
    "main.py",
    "plugins/**",
    "runtime/**",
    "tools/mcp/**"
  ],
  "protected_paths": ["data/**", "characters/**", "third_party/**"],
  "dependency_policy": {"mode": "forbidden", "allowed_files": []},
  "required_profiles": [
    "docs",
    "smoke",
    "core-host",
    "runtime-v2-shell",
    "python-full"
  ],
  "acceptance": {
    "automated": [
      "real chat send, cancel, terminal and generation races pass without duplicate UI terminal state",
      "frozen DOM, geometry, portrait, typewriter, IME and long-text regressions pass",
      "reply navigation preserves bubble height and adaptive bubble/composer commits do not expose child-first clipping or CSS geometry tails",
      "chat.presentation_timing get, atomic save, failure recovery and reopen tests pass",
      "secret, path, history and non-main-window boundary tests pass",
      "locked Rust full tests, formatting and same-SHA three-platform workflow pass"
    ],
    "manual": [
      "maintainer validates immediate subtitle-language refresh, session reply navigation with synchronized portraits, pointer-open menu styling, cancel, and second turn in the Windows Tauri app",
      "maintainer validates Sakura and N.A.V.I. at 100% and 150% DPI with unchanged frozen pet geometry and tear-free 1-to-4-to-1-row composer resizing",
      "maintainer reviews the same candidate SHA platform evidence and rollback boundary"
    ]
  },
  "rollback": [
    "stop new sends and cancel or drain the active generation-scoped chat operation",
    "disable the real chat bridge and chat.presentation_timing capability",
    "restore the WP-3-03 Fake Core presentation path without deleting history or user configuration",
    "revert WP-3-04 implementation commits in reverse order while preserving accepted predecessors"
  ]
}
